{
  "$schema": "./node_modules/@mentra/miniapp-cli/schema/miniapp.schema.json",
  "packageName": "com.xerktech.turma",
  "version": "0.6.45",
  "name": "Turma",
  "description": "Manage your self-hosted Turma fleet of Claude Code sessions from Even Realities G2 glasses: session list, live transcript, question answering, and G2-mic dictation, with a phone companion for Sessions and the ticket Board.",
  "type": "standard",
  "sdkVersion": "0.3.0",
  "minHostVersion": "1.42.0",
  "port": 3103,
  "entry": {
    "background": "background/index.js",
    "ui": "ui/index.html"
  },
  "permissions": [
    {
      "type": "MICROPHONE",
      "description": "Dictate prompts and question answers into your Claude Code sessions (transcribed by your own hub)"
    }
  ],
  "hardwareRequirements": [
    {
      "type": "DISPLAY",
      "level": "REQUIRED",
      "description": "The session list, transcript, and question sheet render on the glasses display"
    },
    {
      "type": "MICROPHONE",
      "level": "OPTIONAL",
      "description": "Glasses-mic dictation; everything else works without it"
    }
  ]
}
